{
  "kind": "evidence",
  "schema_version": "1.0.0",
  "id": "EV-SCENARIO",
  "subject_digest": "sha256:447538844e4c631f9a76881e9a0c2ff6ffcae6fe874e185e76cfea8aa52c9c7e",
  "path": "raw/scenario.json",
  "digest": "sha256:dae21f74489c5d437ac41ddc0f8b2341a97c6447b044cb42abf2e3e8238a8b4c",
  "observed_at": "2026-09-11T23:19:57.136661+00:00",
  "sensitivity": "PUBLIC",
  "role": "OBSERVATION",
  "origin": "EXTERNAL_REFERENCE",
  "summary": "Reference to authored fictional premises only. No product observation or execution was performed."
}
