{
  "kind": "evidence",
  "schema_version": "1.0.0",
  "id": "EV-SCENARIO",
  "subject_digest": "sha256:f8bea6ef0d129c7caf37f2343fb37100d7eff60445f4b5616ddd4845bba065c6",
  "path": "raw/scenario.json",
  "digest": "sha256:0bfcb44605c5e8b53ee17b4c1e1d3cd2147c55c0abf1e37cc883f7b7939367af",
  "observed_at": "2026-09-11T23:19:57.136661+00:00",
  "sensitivity": "PUBLIC",
  "role": "OBSERVATION",
  "origin": "EXTERNAL_REFERENCE",
  "summary": "Reference to authored fictional premises only. No product observation or execution was performed."
}
