{
  "kind": "evidence",
  "schema_version": "1.0.0",
  "id": "EV-OBS",
  "subject_digest": "sha256:1433edcb15661c3af159f06100a15bb8ba4b40ac35cf5a8d172ec44ac4237537",
  "path": "raw/observations.json",
  "digest": "sha256:dd88e71502430bead1624a16280513ddd8265ba53d3246dbeac38b7f63433fa6",
  "observed_at": "2026-09-11T23:19:57.185691+00:00",
  "sensitivity": "PUBLIC",
  "role": "OBSERVATION",
  "origin": "EXAMPLE_EXECUTION",
  "summary": "Actual execution of bundled synthetic example; no real product evaluation."
}
