{
  "kind": "evidence",
  "schema_version": "1.0.0",
  "id": "EV-QUAL",
  "subject_digest": "sha256:6d77fb232b7d0496ff96e887982239501ebd7f6a4a9075360564709d37cb6acc",
  "path": "raw/qualification.json",
  "digest": "sha256:716000a8dfa0907b86038d4ea42f9357fc736c7b2cdadd98c7fbc5ce7a9d29d9",
  "observed_at": "2026-09-11T07:03:49.655887+00:00",
  "sensitivity": "PUBLIC",
  "role": "QUALIFICATION",
  "origin": "EXAMPLE_EXECUTION",
  "summary": "Actual execution of bundled synthetic example; no real product evaluation."
}
